{"authority_identity":null,"authority_identity_status":"unavailable_legacy","blocked_scope":"Operator source relocation, public API or wire changes, dependency changes, records or analysis disposition implementation, successor activation, scientific or protected execution, publication, and release.","created_at":"2026-08-20T12:06:22Z","decision_class":"genuine_human_decision","decision_id":"migration.v2.operators-ownership.decision","declared_authoritative_references":[{"reference_kind":"resource_path","value":"AGENTS.md"},{"reference_kind":"resource_path","value":"docs/architecture/migration/v1-to-v2/implementation/operator-ownership.md"},{"reference_kind":"resource_path","value":"docs/architecture/migration/v1-to-v2/implementation/index.md"},{"reference_kind":"resource_path","value":"docs/architecture/migration/v1-to-v2/index.md"},{"reference_kind":"resource_path","value":"docs/architecture/migration/v1-to-v2/package-module-crosswalk.md"},{"reference_kind":"resource_path","value":"docs/architecture/v1/ksdft2effmass/operators/index.md"},{"reference_kind":"resource_path","value":"docs/architecture/v2/index.md"},{"reference_kind":"resource_path","value":"docs/architecture/v2/ksdft2effmass/analysis/index.md"},{"reference_kind":"resource_path","value":"docs/architecture/v2/ksdft2effmass/index.md"},{"reference_kind":"resource_path","value":"docs/architecture/v2/ksdft2effmass/operators/index.md"},{"reference_kind":"resource_path","value":"docs/architecture/v2/repository-layout.md"},{"reference_kind":"resource_path","value":"docs/publications/research-monograph/manuscript.tex"},{"reference_kind":"resource_path","value":"harness/task-selection.json"},{"reference_kind":"resource_path","value":"harness/tasks/migration.v2.operators-ownership.decision.json"},{"reference_kind":"resource_path","value":"python/src/ksdft2effmass/operators"}],"declared_scope":"Adopt Option A as the Architecture v2 represented-operator ownership model: retain a cohesive, narrowly bounded ksdft2effmass.operators owner for represented records, schema serialization, exact compatibility, fixed-representation Hermiticity, guarded signed differencing, primitive residual metrics, and fixed-representation comparison composition. Higher-level alignment selection, model fitting, continuum reduction, structured learning, transferability analysis, scientific findings, and interpretation remain outside this kernel. Persist and synchronize this decision only; do not move source, change public APIs, wires, dependencies, or scientific settings, activate successors, execute scientific software, publish, or release.","episode_id":"migration.v2.operators-ownership.planning","normalized_outcome":"A","options":[{"consequence":"Preserve the current public and wire foundation; keep compatibility, guarded subtraction, primitive residuals, and fixed-representation comparison together while higher-level alignment, fitting, continuum reduction, structured learning, and scientific interpretation remain with analysis or other applicable owners.","option_id":"A","summary":"Retain a cohesive, narrowly bounded ksdft2effmass.operators owner for represented records and fixed-representation operations."},{"consequence":"Introduce an analysis-to-operators boundary within the guarded comparison chain and require an explicit compatibility and public-import migration plan.","option_id":"B","summary":"Keep represented records, serialization, and compatibility in operators while moving Hermiticity, differencing, residuals, and comparison to analysis."},{"consequence":"Add a new package, compatibility facade, type-identity protections, consumer migration, and facade-retirement obligations.","option_id":"C","summary":"Introduce representations.operators for represented data, move numerical behavior to analysis, and retain operators as a migration facade."},{"consequence":"Keep the ownership branch blocked and retain the Architecture v1 operator owner without selecting a v2 destination.","option_id":"D","summary":"Reconsider or defer."}],"predecessor_decision_id":null,"question":"Which Architecture v2 ownership model should govern represented finite-operator records, serialization, compatibility, Hermiticity, differencing, residuals, and fixed-representation comparison?","recommendation":"Option A. It preserves the accepted represented-operator software foundation, keeps compatibility before arithmetic structurally local, and supplies the broad research monograph with a stable inward kernel without absorbing higher-level scientific analysis.","record_paths":[".pi/checkpoints/migration.v2.operators-ownership.decision.json","docs/architecture/migration/v1-to-v2/implementation/operator-ownership.md","docs/architecture/migration/v1-to-v2/implementation/index.md","docs/architecture/migration/v1-to-v2/index.md","docs/architecture/migration/v1-to-v2/package-module-crosswalk.md","docs/architecture/v2/index.md","docs/architecture/v2/ksdft2effmass/analysis/index.md","docs/architecture/v2/ksdft2effmass/index.md","docs/architecture/v2/ksdft2effmass/operators/index.md","docs/architecture/v2/repository-layout.md","harness/task-selection.json","harness/tasks/migration.v2.operators-ownership.decision.json"],"resolved_at":"2026-08-20T12:06:22Z","response":"Option A authorized","response_source_identity":null,"resumption_status":"option_A_resolved; records-disposition and analysis-disposition planning may proceed only after separate selection and activation; no successor is active","safe_scope":"Persist the resolved ownership decision, synchronize its planning documentation and canonical Task lifecycle state, and identify but do not activate the records-disposition and analysis-disposition successors.","schema_version":2,"selected_option_id":null,"source_provenance":{"adapter_version":"legacy-checkpoint-v2-lossy","legacy_checkpoint_id":"migration.v2.operators-ownership.decision","legacy_status":"resolved","schema_version":1,"source_artifact_identity":"84e950273afb965a5fda8e438b5d15c20f46ecb8edd4af4780b7b437ce3e33ef","source_byte_count":5330,"source_family":"legacy_checkpoint","source_path":".pi/checkpoints/migration.v2.operators-ownership.decision.json","source_schema_version":"1"},"state":"resolved","supersedes_decision_id":null,"task_id":"migration.v2.operators-ownership.decision"}
