{"authority_identity":null,"authority_identity_status":"unavailable_legacy","blocked_scope":"Wannier90 preprocessing, localization, and output extraction for the two synthetic periodic-1D retained spaces until the human explicitly authorizes option A.","created_at":"2026-09-17T10:39:31Z","decision_class":"genuine_human_decision","decision_id":"RM-PERIODIC-1D-W90-RUN-HC01","declared_authoritative_references":[{"reference_kind":"resource_path","value":"AGENTS.md"},{"reference_kind":"resource_path","value":"calculations/research-monograph/periodic-1d/composite-input.json"},{"reference_kind":"resource_path","value":"calculations/research-monograph/periodic-1d/composite-report.md"},{"reference_kind":"resource_path","value":"calculations/research-monograph/periodic-1d/protocol.md"},{"reference_kind":"resource_path","value":"calculations/research-monograph/periodic-1d/wannier90-preflight.md"},{"reference_kind":"resource_path","value":"docs/computational/wannier90-3.1.0-installation.md"},{"reference_kind":"resource_path","value":"docs/publications/research-monograph/appendices/G-one-dimensional-reduction.tex"},{"reference_kind":"resource_path","value":"tasks/research/research-monograph.exercises.periodic-1d.json"}],"declared_scope":"Using the installed local Wannier90 3.1.0 executable and one local process, generate exact synthetic .win, .eig, .mmn, and .amn interface files from the frozen periodic-1D cosine parent for the two retained groups bands 0--1 and 2--3 on the 128-point mesh; run one preprocessing and one localization stage per seed within the documented five-minute, 512 MiB, and 50 MiB envelopes; retain native and scratch outputs externally and retain only sanitized textual inputs, compact identities, extracted comparison results, plots, and documentation in the repository. Do not run Quantum ESPRESSO, change scientific settings, retry a failed scientific stage, transmit data, claim material validation or UQ, or perform release actions.","episode_id":"research-monograph-periodic-1d-wannier90-comparison","normalized_outcome":"A","options":[{"consequence":"Generate exact synthetic interface files from the frozen cosine parent, run Wannier90 3.1.0 preprocessing and localization once for each two-band seed, retain compact provenance and comparison evidence, and make no material-validation claim. Expected runtime is seconds to minutes with one local process, less than 512 MiB memory, and less than 50 MiB total output.","option_id":"A","summary":"Run the bounded local Wannier90 comparison for the low and higher two-band groups."},{"consequence":"No Wannier90 scientific input is executed; the task remains limited to the direct localization and composite-gauge evidence already retained.","option_id":"B","summary":"Do not execute Wannier90 and retain only the direct composite result."}],"predecessor_decision_id":null,"question":"Should the active periodic-1D exercise proceed with the separately authorized local Wannier90 comparison using two bands, 128 reciprocal points, and the retained synthetic overlap data?","recommendation":"Option A, because the direct isolated- and composite-band calculations are complete and the bounded local comparison tests the only remaining independent localization route without invoking Quantum ESPRESSO or material-specific data.","record_paths":[".pi/checkpoints/research-monograph-periodic-1d-wannier90-execution.json","calculations/research-monograph/periodic-1d/wannier90-attempt.json","calculations/research-monograph/periodic-1d/wannier90-preflight.md"],"resolved_at":"2026-09-17T10:39:31Z","response":"ok let's do the wannier90","response_source_identity":null,"resumption_status":"blocked_after_preprocessing_shell_search_failure","safe_scope":"Read-only executable, installation, format, source-example, parent-result, and resource inspection; preparation of the bounded preflight and deterministic interface generator without scientific execution.","schema_version":2,"selected_option_id":null,"source_provenance":{"adapter_version":"legacy-checkpoint-v2-lossy","legacy_checkpoint_id":"RM-PERIODIC-1D-W90-RUN-HC01","legacy_status":"resolved","schema_version":1,"source_artifact_identity":"2b9dafca7c6f28126d0c1ab0e6418c25a7557d16b2d1f077aaecd46f012bc27f","source_byte_count":3722,"source_family":"legacy_checkpoint","source_path":".pi/checkpoints/research-monograph-periodic-1d-wannier90-execution.json","source_schema_version":"1"},"state":"resolved","supersedes_decision_id":null,"task_id":"research-monograph.exercises.periodic-1d"}
