{"authority_identity":null,"authority_identity_status":"unavailable_legacy","blocked_scope":"The public observation-adaptation result type, adapter implementation, Workflow normalized-observation ownership, related exports, tests, and consumer documentation.","created_at":"2026-09-15T08:20:04Z","decision_class":"genuine_human_decision","decision_id":"migration.v2.integration.quantumespresso.adaptation.result-boundary","declared_authoritative_references":[{"reference_kind":"resource_path","value":"AGENTS.md"},{"reference_kind":"resource_path","value":"docs/architecture/migration/v1-to-v2/implementation/qe-observation-adaptation-result-boundary.md"},{"reference_kind":"resource_path","value":"docs/architecture/v2/ksdft2effmass/integration/quantum_espresso/index.md"},{"reference_kind":"resource_path","value":"docs/architecture/v2/ksdft2effmass/workflows/artifact-and-provenance-model.md"},{"reference_kind":"resource_path","value":"harness/tasks/migration.v2.integration.quantumespresso.adaptation.json"},{"reference_kind":"resource_path","value":"harness/tasks/migration.v2.ksdft.plane-wave-disposition.json"},{"reference_kind":"resource_path","value":"python/src/ksdft2effmass/workflows/model.py"}],"declared_scope":"Accept Option C: use a two-stage boundary in which QE integration owns the exact extracted-observation result and a separately activated Workflow task owns the normalization assembler and workflow-owned NormalizedObservationSet. The stages must preserve exact source-content, manifest, parser, policy, result, and failure correlation without changing the retained schema-version-1 neutral record. This decision does not activate the Workflow stage or authorize protected execution, dependency changes, scientific acceptance, publication, release, automatic succession, or administrative closeout.","episode_id":"migration.v2.integration.quantumespresso.adaptation.result-boundary-decision","normalized_outcome":"C","options":[{"consequence":"The QE integration owns one immutable result containing the unchanged neutral record, exact Workflow manifest references, normalization policy identity, and limitations; a generic Workflow normalized set remains deferred.","option_id":"A","summary":"Integration-owned concrete adaptation ResultObject."},{"consequence":"The QE adapter directly returns a new generic Workflow result, requiring a cross-domain public Workflow value contract during this Task.","option_id":"B","summary":"Direct Workflow-owned generic NormalizedObservationSet."},{"consequence":"Integration first closes an extracted-observation result and a separately owned Workflow ActionObject later assembles a generic normalized set, adding two public result boundaries and cross-task implementation.","option_id":"C","summary":"Two-stage integration extraction and Workflow normalization results."},{"consequence":"Keep the adaptation result boundary blocked and revise or defer the architecture decision.","option_id":"D","summary":"Reconsider or defer."}],"predecessor_decision_id":null,"question":"Which public result and ownership boundary should represent exact QEXSD observation adaptation plus Workflow artifact lineage?","recommendation":"Option A, as documented in docs/architecture/migration/v1-to-v2/implementation/qe-observation-adaptation-result-boundary.md.","record_paths":[".pi/checkpoints/migration.v2.integration.quantumespresso.adaptation.result-boundary.json","docs/architecture/migration/v1-to-v2/implementation/qe-observation-adaptation-result-boundary.md","harness/task-selection.json","harness/tasks/migration.v2.integration.quantumespresso.adaptation.json"],"resolved_at":"2026-09-15T08:36:38Z","response":"C","response_source_identity":null,"resumption_status":"option_C_resolved; integration_extraction_stage_resumed; workflow_normalization_stage_requires_separate_task_activation; automatic_successor_activation_disabled","safe_scope":"Read-only inspection, checkpoint and documentation validation, Harness projection synchronization, and reporting of the blocked public-contract boundary; no source implementation or successor activation.","schema_version":2,"selected_option_id":null,"source_provenance":{"adapter_version":"legacy-checkpoint-v2-lossy","legacy_checkpoint_id":"migration.v2.integration.quantumespresso.adaptation.result-boundary","legacy_status":"resolved","schema_version":1,"source_artifact_identity":"da69f4c43365da1b199518fe607af86ee8ed23609b1341a58da0ae7bf32bf5ad","source_byte_count":3996,"source_family":"legacy_checkpoint","source_path":".pi/checkpoints/migration.v2.integration.quantumespresso.adaptation.result-boundary.json","source_schema_version":"1"},"state":"resolved","supersedes_decision_id":null,"task_id":"migration.v2.integration.quantumespresso.adaptation"}
