{"authority_identity":null,"authority_identity_status":"unavailable_legacy","blocked_scope":"Downloading, dependency installation, configuring, compiling, or installing ABINIT until the exact version/source choice is resolved.","created_at":"2026-09-02T04:32:22Z","decision_class":"genuine_human_decision","decision_id":"ABINIT-INSTALL-HC01","declared_authoritative_references":[{"reference_kind":"resource_path","value":"AGENTS.md"},{"reference_kind":"resource_path","value":"docs/architecture/v2/tutorial-examples.md"},{"reference_kind":"resource_path","value":"docs/computational/abinit-tutorial-correspondence.md"},{"reference_kind":"resource_path","value":"harness/tasks/abinit.tutorials.json"},{"reference_kind":"https_uri","value":"https://github.com/abinit/abinit/releases/tag/10.8.3"},{"reference_kind":"https_uri","value":"https://raw.githubusercontent.com/abinit/homebrew-tap/master/Formula/abinit.rb"}],"declared_scope":"Download and verify the official ABINIT 10.8.3 production archive; install or build only the local dependencies or fallbacks required for that source build; configure, compile, and install ABINIT in an isolated external tree; inspect executable identity and version without a scientific input; retain compact source, dependency, build, executable, and test metadata. Do not run a scientific calculation, acquire tutorial pseudopotentials, alter project scientific settings, publish, release, or transmit project calculation data.","episode_id":"direct-work-abinit-installation","normalized_outcome":"A","options":[{"consequence":"Targets the current production interface and tutorial documentation, but requires a manual source build and installation of or fallback builds for missing NetCDF, HDF5, and LibXC dependencies. Expected scale is a 163 MB source archive, several GiB of build/dependency storage, and approximately tens of minutes to more than one hour depending on dependency resolution and compilation. No scientific input will be run during installation.","option_id":"A","summary":"Build the latest official production release, ABINIT 10.8.3, from the official source archive in an isolated external tree."},{"consequence":"Uses the available arm64 macOS bottle and automatic Homebrew dependency resolution, but installs an older production series than the current 10.8.3 tutorials and may add GCC, LibXC, NetCDF, Open MPI, OpenBLAS, FFTW, LibXML2, ScaLAPACK, and Wannier90 formula dependencies. No scientific input will be run during installation.","option_id":"B","summary":"Install ABINIT 10.4.7 from the official ABINIT Homebrew tap."}],"predecessor_decision_id":null,"question":"Which exact ABINIT version and installation source should be installed locally for the tutorial campaign?","recommendation":"Option A: install ABINIT 10.8.3 from the official production archive so new tutorial and parser work targets the current documented format rather than the lagging 10.4.7 Homebrew formula.","record_paths":[".pi/checkpoints/abinit-installation-selection.json","docs/computational/abinit-10.8.3-installation.md"],"resolved_at":"2026-09-02T04:35:26Z","response":"A","response_source_identity":null,"resumption_status":"abinit_10_8_3_source_installation_completed","safe_scope":"Read-only inspection of official ABINIT release, license, installation, formula, toolchain, dependency, disk, and resource metadata.","schema_version":2,"selected_option_id":null,"source_provenance":{"adapter_version":"legacy-checkpoint-v2-lossy","legacy_checkpoint_id":"ABINIT-INSTALL-HC01","legacy_status":"resolved","schema_version":1,"source_artifact_identity":"5498697bf78f41311e4e2eabfdd83af508e1cb07030b7198a689c6d1e3cbc279","source_byte_count":3199,"source_family":"legacy_checkpoint","source_path":".pi/checkpoints/abinit-installation-selection.json","source_schema_version":"1"},"state":"resolved","supersedes_decision_id":null,"task_id":"abinit.tutorials"}
