{"authority_identity":null,"authority_identity_status":"unavailable_legacy","blocked_scope":"Options B and C; Task-wire migration; shared HarnessState compiler or persistence implementation; dependency changes; protected or scientific execution; publication; release; and automatic successor activation.","created_at":"2026-08-19T03:20:56Z","decision_class":"genuine_human_decision","decision_id":"migration.v2.harness.prerequisite-resolution.contract-architecture","declared_authoritative_references":[{"reference_kind":"resource_path","value":"AGENTS.md"},{"reference_kind":"resource_path","value":"docs/architecture/migration/v1-to-v2/implementation/harness/prerequisite-resolution.md"},{"reference_kind":"resource_path","value":"docs/architecture/migration/v1-to-v2/implementation/harness/task-model.md"},{"reference_kind":"resource_path","value":"docs/architecture/v2/ksdft2effmass/harness/object-model.md"},{"reference_kind":"resource_path","value":"harness/tasks/migration.v2.harness.prerequisite-resolution.json"}],"declared_scope":"Accept Option A: consumer-scoped immutable sidecar contracts bound to exact consumer Task content identities and referencing owner-retained results. Preserve HarnessTask version 3; implement a pure explicit-input resolver with distinct Task and external edges and closed satisfied, missing, conflicting, superseded, revoked, unavailable, and indeterminate outcomes. Keep selection, activation, authority, protected execution, scientific state, publication, release, and successor activation separate.","episode_id":"migration.v2.harness.prerequisite-resolution.architecture-decision","normalized_outcome":"A","options":[{"consequence":"Preserve HarnessTask version 3, bind each sidecar to the exact consumer Task content identity, keep result payloads with their domain owners, and implement a pure explicit-input resolver with closed per-edge outcomes.","option_id":"A","summary":"Consumer-scoped immutable sidecar contracts referencing owner-retained results."},{"consequence":"Make each Task self-contained but migrate every canonical Task, serializer, schema, fixture, projection, and consumer while coupling topology to evolving result semantics.","option_id":"B","summary":"Versioned HarnessTask wire with embedded typed prerequisite requirements."},{"consequence":"Preserve the Task wire but defer implementation until shared compiler, persistence, validation, and projection infrastructure exists, with a material risk of duplicating Task-edge state.","option_id":"C","summary":"Central HarnessState prerequisite-policy catalog."},{"consequence":"Keep prerequisite-result implementation blocked and revise or defer the architecture decision.","option_id":"D","summary":"Reconsider or defer."}],"predecessor_decision_id":null,"question":"Which architecture should own typed prerequisite-result matching requirements?","recommendation":"Option A, as documented in docs/architecture/migration/v1-to-v2/implementation/harness/prerequisite-resolution.md.","record_paths":[".pi/checkpoints/migration.v2.harness.prerequisite-resolution.contract-architecture.json","docs/architecture/migration/v1-to-v2/implementation/harness/prerequisite-resolution.md","harness/task-selection.json","harness/tasks/migration.v2.harness.prerequisite-resolution.json"],"resolved_at":"2026-08-19T03:20:56Z","response":"recommend authorized","response_source_identity":null,"resumption_status":"option_A_resolved; sidecar_contract_implementation_authorized; automatic_successor_activation_disabled","safe_scope":"Implement the accepted Option A sidecar contract and pure prerequisite resolver with software verification, synchronized public documentation, compatibility analysis, independent read-only review, deterministic validation, and bounded administrative closeout.","schema_version":2,"selected_option_id":null,"source_provenance":{"adapter_version":"legacy-checkpoint-v2-lossy","legacy_checkpoint_id":"migration.v2.harness.prerequisite-resolution.contract-architecture","legacy_status":"resolved","schema_version":1,"source_artifact_identity":"a8731c5fe0fc7d6e216d9534f7effd446afc7fa013babb02145b833d1da890a2","source_byte_count":3752,"source_family":"legacy_checkpoint","source_path":".pi/checkpoints/migration.v2.harness.prerequisite-resolution.contract-architecture.json","source_schema_version":"1"},"state":"resolved","supersedes_decision_id":null,"task_id":"migration.v2.harness.prerequisite-resolution"}
