{"authority_identity":null,"authority_identity_status":"unavailable_legacy","blocked_scope":"Human acceptance, managed administrative closeout, commit, push, and successor activation for research-monograph.exercises.impurity.defect-1d.blind-alignment.","created_at":"2026-09-17T20:47:57Z","decision_class":"genuine_human_decision","decision_id":"RM-IMPURITY-DEFECT-1D-BLIND-ALIGNMENT-ACCEPTANCE-HC01","declared_authoritative_references":[{"reference_kind":"resource_path","value":"AGENTS.md"},{"reference_kind":"resource_path","value":"calculations/research-monograph/impurity-defect-1d-blind-alignment/protocol.md"},{"reference_kind":"resource_path","value":"calculations/research-monograph/impurity-defect-1d-blind-alignment/report.md"},{"reference_kind":"resource_path","value":"calculations/research-monograph/impurity-defect-1d-blind-alignment/result.json"},{"reference_kind":"resource_path","value":"docs/publications/research-monograph/appendices/I-impurity-effective-mass-models.tex"},{"reference_kind":"resource_path","value":"tasks/research/research-monograph.exercises.impurity.defect-1d.blind-alignment.json"}],"declared_scope":"Accept full-rank map recovery modulo the declared global phase, compressed-sector recovery under undercomplete anchors, the controlled anchor-noise sensitivity sequence, separate alignment, energy-reference, extraction, onsite-model, spectral, and wavefunction diagnostics, the five structured incompatibility stops, and their retained neighboring or explicitly reconciled debugging controls as synthetic software and numerical verification under the documented limitations; accept numerical-rank evaluation at the energy-anchor boundary and eigenspace-projector comparison for a degenerate lowest sector; perform managed administrative closeout including final validation, one in-scope commit, configured-upstream push, and remote-identity verification; do not activate a successor.","episode_id":"research-monograph-impurity-defect-1d-blind-alignment-acceptance","normalized_outcome":"A","options":[{"consequence":"Accept full-rank map recovery modulo the declared global phase, compressed-sector recovery under undercomplete anchors, the controlled anchor-noise sensitivity sequence, separate alignment, energy-reference, extraction, onsite-model, spectral, and wavefunction diagnostics, the five structured incompatibility stops, and their retained neighboring or explicitly reconciled debugging controls as synthetic software and numerical verification under the documented limitations; accept numerical-rank evaluation at the energy-anchor boundary and eigenspace-projector comparison for a degenerate lowest sector; perform managed administrative closeout including final validation, one in-scope commit, configured-upstream push, and remote-identity verification; do not activate a successor.","option_id":"A","summary":"Accept the result and close the task."},{"consequence":"Keep the task active and request one specific analytical, numerical, editorial, or verification correction without activating a successor or expanding into silicon, external execution, scientific validation, uncertainty quantification, or the independent-route follow-on.","option_id":"B","summary":"Do not accept or close the task yet."}],"predecessor_decision_id":null,"question":"Do you accept the synthetic blind-alignment exercise and its documented identifiability and evidence limitations for managed task closeout?","recommendation":"Option A, because the independently reconstructed full-rank, noisy, gauge-equivalent, degenerate, conditioning, principal-angle, rank, spin-space, and energy-anchor controls pass their declared rules; the human-requested diagnostics preserve every original stop, identify the admissible neighboring cases, correct the floating-trace rank boundary, and avoid arbitrary eigenvector fidelity in a degenerate sector; the inference action never receives the authored oracle map; the mini-paper and Appendix I keep every claim synthetic and provisional; and no material, uniqueness, transferability, or UQ claim is made.","record_paths":[".pi/checkpoints/research-monograph-impurity-defect-1d-blind-alignment-acceptance.json","calculations/research-monograph/impurity-defect-1d-blind-alignment/protocol.md","calculations/research-monograph/impurity-defect-1d-blind-alignment/report.md","calculations/research-monograph/impurity-defect-1d-blind-alignment/result.json","docs/publications/research-monograph/appendices/I-impurity-effective-mass-models.tex","tasks/research/research-monograph.exercises.impurity.defect-1d.blind-alignment.json"],"resolved_at":"2026-09-17T21:29:37Z","response":"A","response_source_identity":null,"resumption_status":"impurity_defect_1d_blind_alignment_closed_human_accepted_PASS; no_successor_active","safe_scope":"Read-only inspection, deterministic validation, preservation of retained synthetic artifacts, and reporting without human acceptance, material-validation, transferability, uncertainty-quantification, or successor-activation claims.","schema_version":2,"selected_option_id":null,"source_provenance":{"adapter_version":"legacy-checkpoint-v2-lossy","legacy_checkpoint_id":"RM-IMPURITY-DEFECT-1D-BLIND-ALIGNMENT-ACCEPTANCE-HC01","legacy_status":"resolved","schema_version":1,"source_artifact_identity":"94de7dea3f08067ad0c4f460fb0bc184c79af773ff1ceef52d06047c5b382225","source_byte_count":4933,"source_family":"legacy_checkpoint","source_path":".pi/checkpoints/research-monograph-impurity-defect-1d-blind-alignment-acceptance.json","source_schema_version":"1"},"state":"resolved","supersedes_decision_id":null,"task_id":"research-monograph.exercises.impurity.defect-1d.blind-alignment"}
