{"authority_identity":null,"authority_identity_status":"unavailable_legacy","blocked_scope":"Runner or verifier implementation changes, accepted-parent reads by new Stage C code, any Stage C calculation, Stage B reruns, Stages D and E, DFT, production Wannier90, material transfer, scientific validation, uncertainty quantification, new dependencies, publication, release, deposit, and external transmission remain unauthorized.","created_at":"2026-09-19T04:23:11Z","decision_class":"genuine_human_decision","decision_id":"RM-IMPURITY-DEFECT-2D-STAGE-C-ACCEPTED-PARENT-DESIGN-HC11","declared_authoritative_references":[{"reference_kind":"resource_path","value":"AGENTS.md"},{"reference_kind":"resource_path","value":"calculations/research-monograph/impurity-defect-2d/stage-a-result.json"},{"reference_kind":"resource_path","value":"calculations/research-monograph/impurity-defect-2d/stage-b-result.json"},{"reference_kind":"resource_path","value":"calculations/research-monograph/impurity-defect-2d/stage-c-design.json"},{"reference_kind":"resource_path","value":"calculations/research-monograph/impurity-defect-2d/stage-c-implementation-review.md"},{"reference_kind":"resource_path","value":"calculations/research-monograph/impurity-defect-2d/study-design.json"},{"reference_kind":"resource_path","value":"calculations/research-monograph/periodic-2d/input.json"},{"reference_kind":"resource_path","value":"calculations/research-monograph/periodic-2d/result.json"},{"reference_kind":"resource_path","value":"tasks/research/research-monograph.exercises.impurity.defect-2d.json"}],"declared_scope":"Create and review only the exact accepted-parent Stage C design, protocol, preflight, frozen inventory, verification contract, adverse controls, and resource envelope; synchronize bounded documentation and durable state; do not implement or execute the design.","episode_id":"research-monograph-impurity-defect-2d-stage-c-accepted-parent-design","normalized_outcome":"AUTHORIZE_ACCEPTED_PARENT_STAGE_C_DESIGN_ONLY","options":[{"consequence":"Freeze parent identities, cases, routes, model classes, diagnostics, adverse controls, verification, and resource bounds, then stop before implementation or execution.","option_id":"AUTHORIZE_ACCEPTED_PARENT_STAGE_C_DESIGN_ONLY","summary":"Create and review an exact accepted-parent Stage C design."},{"consequence":"No accepted-parent Stage C design or later implementation proceeds.","option_id":"DO_NOT_AUTHORIZE_STAGE_C_PARENT_DESIGN","summary":"Retain the accepted execution-free Stage C package without parent design."}],"predecessor_decision_id":null,"question":"Authorize design only for the exact accepted-parent Stage C directional/nonlocal calculation, without implementation, accepted-parent reads by new code, or execution?","recommendation":"AUTHORIZE_ACCEPTED_PARENT_STAGE_C_DESIGN_ONLY because the accepted execution-free package establishes the software discriminator, while an exact reviewed parent contract is required before any accepted-parent implementation or execution decision.","record_paths":[".pi/checkpoints/research-monograph-impurity-defect-2d-stage-c-accepted-parent-design.json","calculations/research-monograph/impurity-defect-2d/stage-c-accepted-parent-design.json","calculations/research-monograph/impurity-defect-2d/stage-c-accepted-parent-protocol.md","calculations/research-monograph/impurity-defect-2d/stage-c-accepted-parent-preflight.md","calculations/research-monograph/impurity-defect-2d/stage-c-accepted-parent-adversarial-review.md"],"resolved_at":"2026-09-19T04:23:11Z","response":"recommendation authorized","response_source_identity":null,"resumption_status":"accepted_parent_stage_c_design_only_authorized; implementation_unauthorized; execution_unauthorized; stages_d_and_e_unauthorized; automatic_successor_activation_false","safe_scope":"Design and adversarially review only the accepted-parent Stage C calculation, binding accepted Stage A, Stage B, execution-free Stage C, periodic-parent identities, deterministic inventories, numerical criteria, independent verification, and a local resource envelope.","schema_version":2,"selected_option_id":null,"source_provenance":{"adapter_version":"legacy-checkpoint-v2-lossy","legacy_checkpoint_id":"RM-IMPURITY-DEFECT-2D-STAGE-C-ACCEPTED-PARENT-DESIGN-HC11","legacy_status":"resolved","schema_version":1,"source_artifact_identity":"af896dedae04fe18e9ddd75a660c65abb0a0be171f291f780a1ed7e636252372","source_byte_count":3860,"source_family":"legacy_checkpoint","source_path":".pi/checkpoints/research-monograph-impurity-defect-2d-stage-c-accepted-parent-design.json","source_schema_version":"1"},"state":"resolved","supersedes_decision_id":null,"task_id":"research-monograph.exercises.impurity.defect-2d"}
