{"authority_identity":null,"authority_identity_status":"unavailable_legacy","blocked_scope":"Every additional Wannier90 preprocessing or localization invocation and any change to num_iter or another localization setting.","created_at":"2026-09-17T15:59:44Z","decision_class":"genuine_human_decision","decision_id":"RM-PERIODIC-1D-W90-CONVERGENCE-HC04","declared_authoritative_references":[{"reference_kind":"resource_path","value":"AGENTS.md"},{"reference_kind":"resource_path","value":".pi/checkpoints/research-monograph-periodic-1d-wannier90-execution.json"},{"reference_kind":"resource_path","value":".pi/checkpoints/research-monograph-periodic-1d-wannier90-nonconvergence.json"},{"reference_kind":"resource_path","value":".pi/checkpoints/research-monograph-periodic-1d-wannier90-shell-retry.json"},{"reference_kind":"resource_path","value":"calculations/research-monograph/periodic-1d/composite-input.json"},{"reference_kind":"resource_path","value":"calculations/research-monograph/periodic-1d/wannier90-convergence-proposal.md"},{"reference_kind":"resource_path","value":"calculations/research-monograph/periodic-1d/wannier90-execution.json"},{"reference_kind":"resource_path","value":"calculations/research-monograph/periodic-1d/wannier90-result.json"},{"reference_kind":"resource_path","value":"docs/computational/wannier90-3.1.0-installation.md"},{"reference_kind":"resource_path","value":"tasks/research/research-monograph.exercises.periodic-1d.json"}],"declared_scope":"Run one fresh bounded Wannier90 3.1.0 attempt per seed with only num_iter changed from 500 to 5000. Preserve all other settings; use one local process with five-minute, 512 MiB, and 50 MiB limits; stop without retry upon failure, resource-limit termination, or nonconvergence at 5000 iterations.","episode_id":"research-monograph-periodic-1d-wannier90-convergence-run","normalized_outcome":"A","options":[{"consequence":"For each seed, create a new external run directory, change only num_iter from 500 to 5000, regenerate and preprocess the fixed interface once, generate overlaps from the exact neighbor list, and run localization once using one local process with the existing five-minute, 512 MiB, and 50 MiB limits. Stop without retry if a stage fails, exceeds a limit, or reaches 5000 iterations without satisfying the unchanged convergence rule.","option_id":"A","summary":"Authorize the bounded 5000-iteration convergence attempts."},{"consequence":"Retain the 500-iteration results as nonconverged diagnostics, keep the task active unless separately accepted or cancelled, and perform no additional Wannier90 invocation.","option_id":"B","summary":"Do not execute the convergence study."}],"predecessor_decision_id":null,"question":"May one fresh bounded Wannier90 3.1.0 convergence attempt be run for each synthetic two-band seed with only num_iter changed from 500 to 5000?","recommendation":"Option A, because both retained iteration histories were still descending at iteration 500, increasing only the iteration ceiling preserves the localization objective and convergence rule, and the expected runtime and output remain far below the existing hard limits.","record_paths":[".pi/checkpoints/research-monograph-periodic-1d-wannier90-convergence-run.json","calculations/research-monograph/periodic-1d/wannier90-convergence-attempt.json","calculations/research-monograph/periodic-1d/wannier90-convergence-proposal.md"],"resolved_at":"2026-09-17T16:03:46Z","response":"A","response_source_identity":null,"resumption_status":"completed_bounded_failure_low_pair_not_converged","safe_scope":"Read-only inspection of existing outputs, deterministic validation of the proposal and checkpoint, maintenance of repository documentation and projections, and reporting without external execution.","schema_version":2,"selected_option_id":null,"source_provenance":{"adapter_version":"legacy-checkpoint-v2-lossy","legacy_checkpoint_id":"RM-PERIODIC-1D-W90-CONVERGENCE-HC04","legacy_status":"resolved","schema_version":1,"source_artifact_identity":"b06543f0096419810baf59b8842feb90e99dbcbbd8dc36a5230f588832fb7896","source_byte_count":3484,"source_family":"legacy_checkpoint","source_path":".pi/checkpoints/research-monograph-periodic-1d-wannier90-convergence-run.json","source_schema_version":"1"},"state":"resolved","supersedes_decision_id":null,"task_id":"research-monograph.exercises.periodic-1d"}
